models/vit/swin_v2_s/run_20260427_112808/metrics.json

{
  "history": {
    "epochs": [
      {
        "epoch": 1,
        "stage": "head_only",
        "train_loss": 0.03786479132124402,
        "train_accuracy": 0.9911624473836456,
        "val_loss": 0.012433338385970685,
        "val_accuracy": 0.9966485796361315,
        "val_macro_f1": 0.9967320074478997,
        "learning_rate_backbone": NaN,
        "learning_rate_head": 0.001
      },
      {
        "epoch": 2,
        "stage": "head_only",
        "train_loss": 0.018518856733721254,
        "train_accuracy": 0.9949528198376124,
        "val_loss": 0.013291228647015934,
        "val_accuracy": 0.9976061283115225,
        "val_macro_f1": 0.9975937051933336,
        "learning_rate_backbone": NaN,
        "learning_rate_head": 0.001
      },
      {
        "epoch": 3,
        "stage": "head_only",
        "train_loss": 0.020467795506088887,
        "train_accuracy": 0.9949129211802022,
        "val_loss": 0.014109449648377691,
        "val_accuracy": 0.9972869454197255,
        "val_macro_f1": 0.9973379085295746,
        "learning_rate_backbone": NaN,
        "learning_rate_head": 0.001
      },
      {
        "epoch": 4,
        "stage": "head_only",
        "train_loss": 0.018561977471364885,
        "train_accuracy": 0.9951922117820735,
        "val_loss": 0.013196466660065808,
        "val_accuracy": 0.997765719757421,
        "val_macro_f1": 0.9978009124044865,
        "learning_rate_backbone": NaN,
        "learning_rate_head": 0.0003
      },
      {
        "epoch": 5,
        "stage": "head_only",
        "train_loss": 0.017433673225581488,
        "train_accuracy": 0.9952720090968938,
        "val_loss": 0.013404213940796668,
        "val_accuracy": 0.9976061283115225,
        "val_macro_f1": 0.9976576250523311,
        "learning_rate_backbone": NaN,
        "learning_rate_head": 0.0003
      },
      {
        "epoch": 6,
        "stage": "partial_finetune",
        "train_loss": 0.024783472965651497,
        "train_accuracy": 0.995072515809843,
        "val_loss": 0.01986672466949575,
        "val_accuracy": 0.997127353973827,
        "val_macro_f1": 0.9972280503737293,
        "learning_rate_backbone": 0.0001,
        "learning_rate_head": 0.001
      },
      {
        "epoch": 7,
        "stage": "partial_finetune",
        "train_loss": 0.01638129283917914,
        "train_accuracy": 0.9964889181479043,
        "val_loss": 0.016163639051252912,
        "val_accuracy": 0.997446536865624,
        "val_macro_f1": 0.9975128027462835,
        "learning_rate_backbone": 0.0001,
        "learning_rate_head": 0.001
      },
      {
        "epoch": 8,
        "stage": "partial_finetune",
        "train_loss": 0.014325519765489018,
        "train_accuracy": 0.9972469926386978,
        "val_loss": 0.01656612648280558,
        "val_accuracy": 0.997446536865624,
        "val_macro_f1": 0.9975147671745731,
        "learning_rate_backbone": 0.0001,
        "learning_rate_head": 0.001
      },
      {
        "epoch": 9,
        "stage": "partial_finetune",
        "train_loss": 0.011119079282587381,
        "train_accuracy": 0.9969876513655316,
        "val_loss": 0.013511273414229495,
        "val_accuracy": 0.9976061283115225,
        "val_macro_f1": 0.9976577380788237,
        "learning_rate_backbone": 0.0001,
        "learning_rate_head": 0.001
      },
      {
        "epoch": 10,
        "stage": "partial_finetune",
        "train_loss": 0.011095261693663962,
        "train_accuracy": 0.9972270433099926,
        "val_loss": 0.01725201545110192,
        "val_accuracy": 0.9969677625279285,
        "val_macro_f1": 0.9970520051436714,
        "learning_rate_backbone": 0.0001,
        "learning_rate_head": 0.001
      },
      {
        "epoch": 11,
        "stage": "partial_finetune",
        "train_loss": 0.010171498340443293,
        "train_accuracy": 0.9978654218285554,
        "val_loss": 0.01990098982545236,
        "val_accuracy": 0.9969677625279285,
        "val_macro_f1": 0.997085113885705,
        "learning_rate_backbone": 0.0001,
        "learning_rate_head": 0.001
      },
      {
        "epoch": 12,
        "stage": "partial_finetune",
        "train_loss": 0.00900423856137038,
        "train_accuracy": 0.9976060805553894,
        "val_loss": 0.017422638721752197,
        "val_accuracy": 0.9976061283115225,
        "val_macro_f1": 0.997688747615892,
        "learning_rate_backbone": 3e-05,
        "learning_rate_head": 0.0003
      },
      {
        "epoch": 13,
        "stage": "partial_finetune",
        "train_loss": 0.006062379794571952,
        "train_accuracy": 0.998443952361003,
        "val_loss": 0.01882524045937517,
        "val_accuracy": 0.997446536865624,
        "val_macro_f1": 0.997545571170252,
        "learning_rate_backbone": 3e-05,
        "learning_rate_head": 0.0003
      },
      {
        "epoch": 14,
        "stage": "partial_finetune",
        "train_loss": 0.005203607946727689,
        "train_accuracy": 0.9986234963193489,
        "val_loss": 0.020255870192034953,
        "val_accuracy": 0.997446536865624,
        "val_macro_f1": 0.9975788085819328,
        "learning_rate_backbone": 3e-05,
        "learning_rate_head": 0.0003
      },
      {
        "epoch": 15,
        "stage": "partial_finetune",
        "train_loss": 0.004919908123155993,
        "train_accuracy": 0.9985835976619387,
        "val_loss": 0.02015636532671186,
        "val_accuracy": 0.9976061283115225,
        "val_macro_f1": 0.9977551917618767,
        "learning_rate_backbone": 9e-06,
        "learning_rate_head": 8.999999999999999e-05
      },
      {
        "epoch": 16,
        "stage": "partial_finetune",
        "train_loss": 0.004328372886241901,
        "train_accuracy": 0.9987232429628743,
        "val_loss": 0.020005931517128893,
        "val_accuracy": 0.9976061283115225,
        "val_macro_f1": 0.9977219873813582,
        "learning_rate_backbone": 9e-06,
        "learning_rate_head": 8.999999999999999e-05
      },
      {
        "epoch": 17,
        "stage": "partial_finetune",
        "train_loss": 0.0038416331524048783,
        "train_accuracy": 0.9989825842360405,
        "val_loss": 0.01946375452212697,
        "val_accuracy": 0.997446536865624,
        "val_macro_f1": 0.9975788085819328,
        "learning_rate_backbone": 9e-06,
        "learning_rate_head": 8.999999999999999e-05
      },
      {
        "epoch": 18,
        "stage": "partial_finetune",
        "train_loss": 0.004293296945790194,
        "train_accuracy": 0.99886288826381,
        "val_loss": 0.021292516171570748,
        "val_accuracy": 0.9976061283115225,
        "val_macro_f1": 0.9977219873813582,
        "learning_rate_backbone": 2.7e-06,
        "learning_rate_head": 2.6999999999999996e-05
      },
      {
        "epoch": 19,
        "stage": "partial_finetune",
        "train_loss": 0.004448383732041365,
        "train_accuracy": 0.9988030402776946,
        "val_loss": 0.02119078641496373,
        "val_accuracy": 0.997446536865624,
        "val_macro_f1": 0.9975788085819328,
        "learning_rate_backbone": 2.7e-06,
        "learning_rate_head": 2.6999999999999996e-05
      },
      {
        "epoch": 20,
        "stage": "partial_finetune",
        "train_loss": 0.003363575140016848,
        "train_accuracy": 0.9991820775230913,
        "val_loss": 0.0213112041587233,
        "val_accuracy": 0.997446536865624,
        "val_macro_f1": 0.9975788085819328,
        "learning_rate_backbone": 2.7e-06,
        "learning_rate_head": 2.6999999999999996e-05
      }
    ]
  },
  "best_epoch": 4,
  "best_stage": "head_only",
  "best_val_macro_f1": 0.9978009124044865,
  "best_val_loss": 0.013196466660065808,
  "best_val_accuracy": 0.997765719757421,
  "test_loss": 0.016234910415839132,
  "test_accuracy": 0.996169805298436,
  "test_macro_f1": 0.9962715304755512,
  "test_confusion_matrix": [
    [
      2362,
      7,
      1
    ],
    [
      8,
      2277,
      4
    ],
    [
      2,
      2,
      1603
    ]
  ],
  "latency_ms_per_batch": 33.69090350024635,
  "latency_ms_per_image": 2.105681468765397,
  "throughput_img_per_sec": 474.9056373594435,
  "num_timed_batches": 20.0,
  "parameter_count": 48970749,
  "trainable_parameter_count": 15386931,
  "model_size_mb": 187.59978103637695,
  "device_info": {
    "device": "cuda",
    "cuda_available": true,
    "amp_enabled": true,
    "num_workers": 8,
    "batch_size": 16,
    "gpu_name": "NVIDIA RTX A5000",
    "gpu_total_memory_mb": 24214,
    "cuda_device_index": 0
  },
  "onnx_export": {
    "attempted": true,
    "succeeded": false,
    "path": "/home/temporaryuser4/Desktop/rufiz/~/AnimalClassification/AnimalClassification_server/models/vit/swin_v2_s/run_20260427_112808/exported.onnx",
    "error": "ModuleNotFoundError: ONNX export requires the 'onnx' package to be installed."
  }
}

README.md

## ViT-B16 Pretrained

- **Best epoch:** 13
- **Best validation loss:** 0.0197
- **Best validation macro F1:** 0.9977

## Swin-T Pretrained

- **Best epoch:** 9
- **Best validation loss:** 0.0141
- **Best validation macro F1:** 0.9982

## Swin V2-S Pretrained

- **Best epoch:** 4
- **Best validation loss:** 0.0132
- **Best validation macro F1:** 0.9978

## MaxViT-T Pretrained

- **Best epoch:** 15
- **Best validation loss:** 0.0188
- **Best validation macro F1:** 0.9978

# Experimental Results

The strongest completed result comes from **MaxViT-T Pretrained**, which achieves **0.9974 test accuracy** and **0.9976 test macro F1**. `Swin-T Pretrained` is extremely close while being lighter and faster than ViT-B/16. Among pretrained CNNs, `ResNet50 Pretrained` remains the strongest CNN transfer-learning result, and `ResNet18 Pretrained` remains an excellent efficiency baseline. The earlier **fixed ResNet50 embedding** baseline remains extremely strong, showing that the dataset benefits heavily from pretrained visual representations. Among models trained from scratch, `CustomCNN v2` is the strongest scratch CNN, while `CustomViT v2` improves over `CustomViT v1` but does not outperform the scratch CNN family.